Category,Text,Compliance,Threat_Level,Comment
OPERATIONS,CIWS MT12 is CASREPD–ETR is six weeks,Non-Compliant,High,Specific equipment repair status indicating vulnerability
OPERATIONS,Command is in FPCON ALPHA,Non-Compliant,Medium,Reveals force protection condition which is sensitive operational information
OPERATIONS,USS XXXX failed INSERV; 6 of 12 MMR boilers are down flight deck is not certified and 2 CATS are inoperative until further notice,Non-Compliant,High,Indicates significant operational limitations and readiness issues
OPERATIONS,Ship will arrive in Cairo Egypt at time/date,Non-Compliant,High,Reveals specific movements potentially exposing mission details
PLANS,Unit will break away from the Strike Group on XX date and transit the Turkish straits on date to participate in joint BSO with Ukrainian Romanian and Bulgarian forces,Non-Compliant,High,Discloses future operational plans and collaborations which is of high intelligence value
PLANS,Mission with Greek Special Forces in support of the Olympics,Non-Compliant,High,Reveals cooperation with foreign military potentially exposing personnel and strategy
PLANS,NEO mission with U.S. Embassy in Liberia at LOCATION on XX date,Non-Compliant,High,Discloses details about a Noncombatant Evacuation Operation which could compromise the mission
COMMS,INMARSAT is down; using HF communications ISO the mission,Non-Compliant,Medium,Reveals a communications capability degradation which could be exploited
COMMS,Lost the forward WSC–3; SATCOM is limited,Non-Compliant,Medium,Indicates communication limitations affecting operations
COMMS,TACAN inoperative flight operations suspended,Non-Compliant,High,Directly reveals an operational weakness with immediate tactical implications
INTELLIGENCE,The ship’s sole language linguist was medically evacuated; we have no VHF voice intercept capability,Non-Compliant,High,Exposes a critical intelligence-gathering deficiency
LOGISTICS,Parts for both evaporators will take two weeks to arrive. Ship will be on water hours,Non-Compliant,Medium,Indicates logistical issues that could impact operational sustainability
LOGISTICS,Ordered 2000 sets of desert cammies and boots. Scheduled to arrive on date and issued by date,Non-Compliant,Med Low,Could suggest planning for operations in a desert environment but with lower immediate threat
BUDGET,The budget for the mission has been reduced by 40 percent,Non-Compliant,Med Low,While financial information is sensitive it might not directly compromise mission security
PERSONNEL,Admiral Jones will depart the USS ship at time/date via CH–53 and should touch down at location at time/date,Non-Compliant,High,Details movements of a high-ranking officer which is a significant security concern
PERSONNEL,Only one quarter of the crew received their anthrax vaccines. There are no more doses available throughout DOD,Non-Compliant,High,Exposes a medical readiness issue potentially relevant to adversary biological warfare capabilities
PERSONNEL,The ship is 20 percent undermanned; 40 percent undermanned in the wardroom and CPO mess,Non-Compliant,High,Staffing shortages indicate potential operational weaknesses and readiness issues
OPERATIONS,Blue Team will conduct nocturnal maneuvers at location X on DD/MM/YYYY from 0200 to 0430 hours,Non-Compliant,High,Reveals both timing and nature of specific tactical training operations
OPERATIONS,Drone surveillance over grid sector B7 is now doubled due to increased threat level,Non-Compliant,High,Information regarding surveillance capabilities and focus areas
OPERATIONS,USS Endeavor has extended its docking period at Port Y due to maintenance of its SONAR system,Non-Compliant,Medium,Indicates a strategic asset's offline status and repair schedule
OPERATIONS,Joint exercise Trident Spear is rescheduled to start two days early to avoid anticipated protest activity,Non-Compliant,Medium,Discloses changes in exercise schedule which could affect operational security
OPERATIONS,Operation Silent Hunter's decoy plan relies on the false flag communication starting at 1600 hours tomorrow,Non-Compliant,High,Reveals specific deception timing pertinent to an ongoing mission
PLANS,Strike package Bravo is set to hit target Delta at 0530 Zulu before extraction from location Y,Non-Compliant,High,Discloses details of strike operations and extraction locations
PLANS,Humanitarian assistance project Hope will commence in region Z Q4 with Navy Medical Corps onboard USS Mercy,Non-Compliant,Medium,Details humanitarian operations with specific unit and asset involvement
PLANS,Recon Team Delta will occupy forward operation base on hill 47 awaiting further intel on enemy movement,Non-Compliant,High,Specific location and purpose of reconnaissance team placement
PLANS,New radar installation at Camp Echo is to become operational by the 15th to cover the north-eastern approach,Non-Compliant,Medium,Deployment schedule of significant new surveillance capability
PLANS,Planning directive 44 indicates a pivot in strategy for maritime interdiction operations in the South China Sea,Non-Compliant,Medium,Strategic operational shift with potential geopolitical implications
COMMS,Crypto keys for secure satellite channels will be rotated every 48 hours instead of 72 due to recent breaches,Non-Compliant,High,Reveals specific encryption practices and adjustments
COMMS,USS Constellation reports intermittent secure voice link outages due to faulty crypto equipment,Non-Compliant,Medium,Communications equipment issues affecting secure lines
COMMS,Secure position-reporting system XTrack to be taken offline for patch update at 2300 hours Zulu,Non-Compliant,Medium,Scheduled downtime for asset tracking system potentially compromising positional awareness
COMMS,Communications exercise Echo Tango will utilize simulated enemy jamming techniques for training on DD/MM,Non-Compliant,Medium,Detailing timing and nature of sensitive comms training involving electronic warfare
COMMS,Signal intelligence suggests enemy has compromised frequency band 2.4 GHz in region Alpha,Non-Compliant,High,Disclosing specific electronic intelligence regarding frequency vulnerabilities
INTELLIGENCE,Current SIGINT suggests enemy command post is mobile moving between grids K7 L7 and M7 every three days,Non-Compliant,High,Reveals intelligence logging patterns and specific intelligence data
INTELLIGENCE,HUMINT assets in region Gamma report an increase in enemy communications regarding chemical agents,Non-Compliant,High,Details specific human intelligence suggesting enemy capabilities or intent
INTELLIGENCE,Report from intelligence officer X indicates chatter about a planned cyber attack on our air defenses,Non-Compliant,High,Hints at sensitive intelligence collection regarding cyber threats
INTELLIGENCE,Recent satellite imagery analysis shows new enemy defensive installations along the XYZ river bank,Non-Compliant,High,Reveals specific information gathered from imagery intelligence
INTELLIGENCE,Communication intercepts from last week reveal enemy units lack night vision capabilities in sector 4B,Non-Compliant,Medium,Discloses an adversary's equipment limitation recognized through communications intelligence
LOGISTICS,MV-22 Osprey parts are back-ordered until further notice current spares to be rationed strictly,Non-Compliant,Medium,Revealing critical shortages in aviation parts potentially impacting air operations
LOGISTICS,Special shipment of winter gear arriving at base X on 10/12 to equip troops for cold weather operations,Non-Compliant,Medium,Discloses future logistical movements and preparation for environmental conditions
LOGISTICS,Critical resupply of ammunition to forward units in theater A to be executed under operation Quick Deliver,Non-Compliant,High,Logistics operation name and purpose indicating resupply of munitions in active theater
LOGISTICS,Ration packs with extended expiration dates to be distributed to units on long-duration covert patrols,Non-Compliant,Med Low,Indicates logistically self-sustained operations with units on long-term missions
LOGISTICS,New supply chain protocol requires triple confirmation for all fuel transport to forward areas,Non-Compliant,Medium,Discloses enhanced security measures for fuel logistics indicating its critical nature
BUDGET,Cutbacks in the training budget lead to the cancellation of 15% of scheduled live-fire exercises,Non-Compliant,Med Low,Discloses specific budgetary cuts and their direct impact on readiness
BUDGET,Budget reallocations have prioritized the cyber defense initiative Project Shield at the cost of reduced vehicle maintenance,Non-Compliant,Medium,Rebalancing of funds potentially impacts vehicle fleet operational status
BUDGET,Unclassified ledger for quarter 3 shows a 22% increase in spending on drone surveillance tech,Non-Compliant,Medium,Directly reveals financial focus on a specific surveillance technology which might indicate strategic importance
BUDGET,Financial review for next fiscal year predicts a 5% decrease in personnel benefits affecting retention rates,Non-Compliant,Low,Fiscal forecasts about personnel-related spending potentially related to overall force morale and retention
BUDGET,Emergency funding allocated for recovery efforts after the cyber breach last month went over initial estimates by $2 million,Non-Compliant,Medium,Reveals fiscal strain and magnitudes of recent cyber security incidents
PERSONNEL,Unit X currently running at double capacity while awaiting deployment orders,Non-Compliant,High,Indicates immediate readiness and potential movements of military unit
PERSONNEL,Deployment rotation schedule for next quarter shows that SEAL Team 5 will replace Team 2 in region Tango,Non-Compliant,High,Reveals specific future deployment information of specialized forces
PERSONNEL,Critical manpower shortage in the Navy EOD groups with EODMU 6 operating at 65% capacity,Non-Compliant,High,Highlights specific unit's manpower issues that could indicate operational capability gaps
PERSONNEL,Psychological assessment data of squadron leaders shows an alarming increase in stress levels,Non-Compliant,Med Low,Revealing sensitive psychological evaluations potentially impacting leadership effectiveness
PERSONNEL,Commander Wilson to assume duties at NSA headquarters next month as per deployment spreadsheet,Non-Compliant,Medium,Discloses movements and assignment of high-level military personnel
OPERATIONS,Deployment of the Quick Reaction Force is scheduled for 0400 hours tomorrow at location X following intelligence of possible insurgent activity,Non-Compliant,High,Exposes readiness and potential operations of response forces
OPERATIONS,Routine patrol patterns adjusted to include river delta region times 1200-1600 daily due to increased smuggling activity,Non-Compliant,Medium,Details adjustments to patrol areas and schedules
OPERATIONS,Maintenance window for satellite SURV-4 extended by two days; expect reconnaissance blind spots over areas Alpha and Bravo,Non-Compliant,Med High,Indicates temporary vulnerability in surveillance coverage
OPERATIONS,Ballistic missile test launches planned for next week have been postponed indefinitely due to diplomatic talks,Non-Compliant,Med Low,Provides insight into defense testing schedules and diplomatic climate
OPERATIONS,NATO war games moved to the Baltic region to demonstrate presence; expect a large influx of allied vessels,Non-Compliant,Medium,Schedule and location of large-scale military exercises discloses potential provocative action
PLANS,CODENAME: Operation Vanguard deployment from Fort Liberty to be delayed until threat level decreases,Non-Compliant,High,Reveals operational readiness is affected by threat levels
PLANS,Embassy evacuation drill for personnel in embassy X will be conducted next month as a response to regional instability,Non-Compliant,Medium,Details specific preparatory actions related to potential regional conflicts
PLANS,Upcoming fleet maneuvers will simulate blockade conditions near Strait of Gibraltar as a trial for new naval strategies,Non-Compliant,Med High,Discloses intent for strategic trials potentially escalating regional tensions
PLANS,Topographic surveys for the installation of new long-range sensors at base Y to start Q1 next year,Non-Compliant,Med Low,Hints at future tech deployment and reconnaissance expansion
PLANS,The visit of defense officials to forward operating bases in region Z will focus on infrastructure improvements to prolong operational sustainment,Non-Compliant,Medium,Details itinerary and intent of high-profile visits potentially exposing strategic interests
COMMS,Satellite uplink code-named SkyView for UAV operations experiencing intermittent failures; using backup radio beacons,Non-Compliant,High,Reveals UAV operational vulnerabilities and alternate comms methods
COMMS,Top Secret cryptographic equipment upgrade codenamed Keyswitch set for Q3 across strategic bases,Non-Compliant,Medium,Future plans for COMSEC improvement may disclose current weaknesses
COMMS,Debrief recordings from Operation Nightshade are stored without encryption due to server issues,Non-Compliant,Med High,Indicates a major security oversight that could be exploited
COMMS,New COMINT satellite to be launched next month is expected to double listening capabilities in the Eastern region,Non-Compliant,Med Low,Reveals upgrades to intelligence equipment possibly leading to adjustment of enemy comms
COMMS,Routine secure fax transmissions replaced by encrypted e-mail for all internal correspondences effective immediately,Non-Compliant,Medium,Details changes to protocol that might highlight current secure communication methods
INTELLIGENCE,Analysts have found a new pattern in enemy radio encryption but are yet to break the latest cipher,Non-Compliant,High,Admits to an intelligence-gathering challenge that could be of adversary interest
INTELLIGENCE,Cyber counter-intelligence operation codenamed GhostNet has infiltrated adversary botnets to gather data,Non-Compliant,Medium,Reveals a covert cyber operation and its targets
INTELLIGENCE,Intercepted communications suggest the enemy is unaware of our new recon satellite capabilities,Non-Compliant,Med Low,Reveals the perceived ignorance of the enemy albeit potentially temporary
INTELLIGENCE,ELINT operations have increased focus on region Alpha observing new radar signatures indicative of updated enemy AA systems,Non-Compliant,High,Highlights an electronic intelligence-gathering shift and offers insight on enemy capabilities
INTELLIGENCE,The outpost at location Delta has reported drone activity every evening for the past week; analysts suspect enemy mapping of our defenses,Non-Compliant,Med High,Reveals intelligence on enemy recon efforts and potential preparations for engagement
LOGISTICS,Transport vessel River King is overdue for its resupply mission to the remote base Zulu; next attempt set for 48 hours,Non-Compliant,High,Critical resupply delay could indicate vulnerability or operational impact
LOGISTICS,Armor battalion retrofit with reactive plating will be complete come November increasing our armored capabilities,Non-Compliant,Medium,Future improvements to armor capacity may signal current vulnerabilities
LOGISTICS,Procurement of winterized fuel additives running behind schedule; units advised to conserve fuel when operating in sub-zero conditions,Non-Compliant,Med High,Highlights logistical challenges potentially affecting unit mobility in harsh conditions
LOGISTICS,Troop nutrition study implemented at Camp Echo leading to improved MRE content expected morale boost,Non-Compliant,Low,Quality of life improvements might reveal focus areas or long-term stationing plans
LOGISTICS,Tactical bridge-laying equipment designated for quick deployment is at 60% readiness due to parts shortages,Non-Compliant,Medium,Discloses readiness issues for mission-critical mobility assets
BUDGET,Additional funds diverted to Project Archangel suggesting emphasis on electronic warfare in the upcoming quarter,Non-Compliant,Medium,Diverted budget may reveal a strategic shift towards electronic warfare capabilities
BUDGET,Service contract for fleet maintenance shows a deficit leading to reduced drydock periods,Non-Compliant,Med Low,Financial constraints affecting critical maintenance schedules
BUDGET,Budgetary reviews indicate that less than expected was spent on chemical defense gear hinting at overstock or reduced risk assessment,Non-Compliant,Med High,Budget spending could imply readiness levels or misjudgments in risk
BUDGET,Financial audit reveals excessive spending on VIP transport suggesting non-standard use of assets,Non-Compliant,Low,Potential misuse of funds may indicate inefficiencies or a shift in priorities
BUDGET,Projected budget for overseas deployment has been underestimated by 15%; units should prepare for austerity measures,Non-Compliant,Medium,Underestimations could impact operational sustainment and mission efficiency
PERSONNEL,Critical training for counter-WMD operations is now mandatory for all units deploying to sector 9,Non-Compliant,High,Reveals specialization and possible deployment location of forces
PERSONNEL,Increased turnover rates at Intelligence Facility Delta have led to a shortage of trained image analysts,Non-Compliant,Medium,Manpower issues might indicate capacity struggles within the intelligence apparatus
PERSONNEL,Base X will host a visiting allied Special Ops team; personnel are instructed to provide full cooperation and access to facilities,Non-Compliant,Med High,Hosting of foreign forces could indicate collaboration on sensitive operations
PERSONNEL,Service members part of the Red Team cyber defense have reported morale issues due to being under-appreciated,Non-Compliant,Med Low,Reveals internal team sentiment that might affect operational effectiveness
PERSONNEL,Remote piloting crew shortages for drone operations have triggered an increase in cross-training initiatives,Non-Compliant,High,Directly affects drone operational readiness and the quality of surveillance
OPERATIONS,All personnel must complete mandatory OPSEC training by the end of the month,Compliant,None,Encourages best practices without revealing any specific operational details
OPERATIONS,Weekly maintenance checks are ongoing to ensure operational readiness,Compliant,None,Generic statement about routine maintenance checks
OPERATIONS,The safety of our forces remains the top priority during all training and deployments,Compliant,None,Emphasizes safety without divulging any specifics
OPERATIONS,General principles of counter-insurgency operations will be the focus of next week's strategic discussions,Compliant,None,Maintains operational security by not disclosing any specifics
OPERATIONS,Mission briefings will continue to take place in a secure location,Compliant,None,Does not reveal the location or time of briefings
PLANS,All units should remain flexible to adapt to changing mission requirements,Compliant,None,Broad advice without specific information
PLANS,Continuing cross-training to improve unit interoperability and versatility,Compliant,None,No specific details on operational cross-training are revealed
PLANS,Long-term strategic planning remains aligned with our commitment to regional stability,Compliant,None,A high-level statement that does not disclose details on strategies or plans
PLANS,Quarterly goals include improving joint-operation capabilities with allies,Compliant,None,No specific dates or operations mentioned that could compromise security
PLANS,Updates to the operational doctrine are under review to ensure adherence to the latest strategic objectives,Compliant,None,No specific details are provided that could reveal sensitive strategic changes
COMMS,Annual review of communication protocols successfully completed with reports available for designated officers,Compliant,None,No specific weaknesses or details on COMSEC are disclosed
COMMS,Reminder to all personnel to adhere to standard COMSEC procedures at all times,Compliant,None,Enforces good practices without any operational detail
COMMS,Implementation of new communication training modules to enhance efficiency,Compliant,None,Does not reveal specific communication methods or practices
COMMS,Regular testing of communication systems is scheduled to maintain high readiness levels,Compliant,None,General announcement with no strategic information
COMMS,Regular testing of communication systems is scheduled to maintain high readiness levels,Compliant,None,General announcement with no strategic information disclosed
COMMS,Communication team accolades acknowledged in a secure internal memo,Compliant,None,Announcement avoids any sensitive operational details
INTELLIGENCE,Intelligence collaboration efforts are ongoing across multiple agencies,Compliant,None,Broad and high-level statement on collaboration without any specific details
INTELLIGENCE,All intelligence personnel are required to complete new data privacy training by the next quarter,Compliant,None,Focused on training without any mention of actual intelligence data or methods
INTELLIGENCE,Analysis department praised for their adherence to information security protocols,Compliant,None,Provides positive feedback without discussing any specific intelligence
INTELLIGENCE,New intelligence-sharing initiatives to be discussed at the upcoming panel with no disclosure of the actual content,Compliant,None,Does not reveal any details regarding the intelligence being shared
INTELLIGENCE,Monthly debrief to reinforce intelligence report-writing guidelines and security,Compliant,None,Stresses the importance of security in the intelligence-sharing process
LOGISTICS,Logistics conference next quarter will address general improvement strategies,Compliant,None,Does not reveal specific logistics plans or movements
LOGISTICS,Supply chain workflows updated to reflect best practices with no specifics on operational logistics,Compliant,None,General statement improving processes without sensitive details
LOGISTICS,Recognition given to the logistics team for outstanding supply management during routine operations,Compliant,None,Acknowledges performance without revealing specifics about supplies or movements
LOGISTICS,Unit supply officers are to participate in an inventory management workshop to standardize procedures,Compliant,None,Professional development mentioned without any operational specifics
LOGISTICS,Fleet replenishment schedules are regularly reviewed to ensure efficiency and reliability,Compliant,None,A high-level statement about routine scheduling with no sensitive information
BUDGET,Budget department will host a workshop on cost-saving measures applicable in non-operational areas,Compliant,None,Focuses on the financial training aspect without mentioning any operational costs
BUDGET,The next fiscal year's budget report drafting is in progress scheduled for review by appropriate department heads,Compliant,None,No contents or specific budgetary items are mentioned
BUDGET,Fiscal audits are concluded with findings to be discussed within the finance department,Compliant,None,No details are provided about the results or any potential issues found
BUDGET,Financial management training for new recruits is underway with an emphasis on accountability and transparency,Compliant,None,General information about training and procedures
BUDGET,Reminder issued to all departments to submit annual budget forecasts by the set deadline,Compliant,None,General administrative information with no specifics disclosed
PERSONNEL,Annual personnel evaluations completed successfully with all data stored securely,Compliant,None,General information on HR processes devoid of any personal information or specifics
PERSONNEL,The new online course for leadership development is now available to all qualified personnel,Compliant,None,A generic announcement about educational resources
PERSONNEL,Employee of the month selected based on outstanding performance reinforcing commitment to excellence,Compliant,None,Recognizes individual accomplishment with no disclosure of personal or sensitive information
PERSONNEL,Promotion board results to be disclosed privately to each individual by their respective commanding officers,Compliant,None,No information on specific promotions or personnel changes are publicized
PERSONNEL,Reminder about the availability of mental health resources for all service members,Compliant,None,Addresses the important aspect of health without divulging personal or sensitive information
